product_category,product_name,product_slug,product_description,product_summary,product_status,product_thumbnail,product_images,product_options,variant_name,variant_sku,variant_barcode,variant_price,variant_compare_at_price,variant_cost_price,variant_inventory_quantity,variant_track_inventory,variant_continue_selling_out_of_stock,variant_weight,variant_weight_unit,variant_width,variant_height,variant_depth,variant_dimension_unit,variant_options
Garden,"Id Est Praesentium (Garden)",id-est-praesentium-garden,"Sed quos dolorem eos sequi quis. Est velit quidem qui et. Aliquam recusandae odio sunt dolor voluptatum.","Nostrum consequuntur et mollitia quo in non.",active,https://picsum.photos/300/300?random=81,"[""https:\/\/picsum.photos\/600\/600?random=810"",""https:\/\/picsum.photos\/600\/600?random=811""]","[{""name"":""Color"",""values"":[""Black"",""White""]},{""name"":""Size"",""values"":[""S"",""M"",""L""]}]","Id Est Praesentium (Garden) - Black / S",VLW-00081,6685684229875,121.14,,71.68,120,1,0,4353.5,g,27.86,35.55,24.74,cm,"{""Color"":""Black"",""Size"":""S""}"
Garden,"Assumenda Quaerat Doloribus (Garden)",assumenda-quaerat-doloribus-garden,"Molestiae voluptate ipsa harum officiis. Nulla distinctio unde unde quod. Sunt est sit ut ut laboriosam possimus aliquid et. Nihil sit officia ullam est.","Provident earum et velit accusamus.",active,https://picsum.photos/300/300?random=82,"[""https:\/\/picsum.photos\/600\/600?random=820"",""https:\/\/picsum.photos\/600\/600?random=821""]","[{""name"":""Color"",""values"":[""Black"",""White""]},{""name"":""Size"",""values"":[""S"",""M"",""L""]}]","Assumenda Quaerat Doloribus (Garden) - White / M",EBJ-00082,8707115537132,227.34,272.81,174.88,23,1,0,3280.82,g,8.71,17.62,45.69,cm,"{""Color"":""White"",""Size"":""M""}"
Garden,"Sint Nihil Veniam (Garden)",sint-nihil-veniam-garden,"Minus sunt commodi aut id. Quis possimus animi beatae quibusdam non. Tempora deleniti vero ea delectus architecto. Ut omnis itaque voluptates dicta voluptatem est. Qui voluptatem velit fugit voluptatem cupiditate id officiis.","Sit repellat porro id repellendus.",active,https://picsum.photos/300/300?random=83,"[""https:\/\/picsum.photos\/600\/600?random=830"",""https:\/\/picsum.photos\/600\/600?random=831""]","[{""name"":""Color"",""values"":[""Black"",""White""]},{""name"":""Size"",""values"":[""S"",""M"",""L""]}]","Sint Nihil Veniam (Garden) - Black / M",KP1-00083,3622366087036,403.21,483.85,199.61,136,1,0,2244.61,g,10.76,32.08,6.05,cm,"{""Color"":""Black"",""Size"":""M""}"
Garden,"Dicta Iste Aut (Garden)",dicta-iste-aut-garden,"Qui vel rerum omnis et explicabo laborum necessitatibus. Voluptates consectetur magnam in pariatur et dolorum et. Possimus officiis veritatis dolor ullam cumque. Nihil non nulla autem est. Pariatur possimus et beatae.","Magni qui omnis sit et.",active,https://picsum.photos/300/300?random=84,"[""https:\/\/picsum.photos\/600\/600?random=840"",""https:\/\/picsum.photos\/600\/600?random=841""]","[{""name"":""Color"",""values"":[""Black"",""White""]},{""name"":""Size"",""values"":[""S"",""M"",""L""]}]","Dicta Iste Aut (Garden) - Black / M",SBU-00084,2971459116254,300.32,,196.29,43,1,0,1442.02,g,41.08,38.98,27.51,cm,"{""Color"":""Black"",""Size"":""M""}"
Garden,"A Ullam Nesciunt (Garden)",a-ullam-nesciunt-garden,"Quibusdam vitae non ut maxime quo suscipit. Recusandae sit praesentium molestiae beatae. Corporis in blanditiis unde nam impedit sapiente. Repellendus sit consectetur odit sapiente accusantium ipsum.","Est et excepturi vel.",active,https://picsum.photos/300/300?random=85,"[""https:\/\/picsum.photos\/600\/600?random=850"",""https:\/\/picsum.photos\/600\/600?random=851""]","[{""name"":""Color"",""values"":[""Black"",""White""]},{""name"":""Size"",""values"":[""S"",""M"",""L""]}]","A Ullam Nesciunt (Garden) - White / L",IQF-00085,8118858905377,149.68,,115.14,96,1,1,4936.2,g,25.23,34.99,11.61,cm,"{""Color"":""White"",""Size"":""L""}"
Garden,"Nam Facilis Quo (Garden)",nam-facilis-quo-garden,"Necessitatibus reprehenderit velit deleniti facere. Est consectetur quo in dolor. Nobis perferendis quia ipsam minus et. Iusto quae accusantium sit. Neque quia natus doloribus molestias facere esse rerum.","Adipisci qui itaque id repellat quia aut provident pariatur.",active,https://picsum.photos/300/300?random=86,"[""https:\/\/picsum.photos\/600\/600?random=860"",""https:\/\/picsum.photos\/600\/600?random=861""]","[{""name"":""Color"",""values"":[""Black"",""White""]},{""name"":""Size"",""values"":[""S"",""M"",""L""]}]","Nam Facilis Quo (Garden) - White / M",C6U-00086,8191730321441,409.23,491.07,174.14,66,1,0,3683.16,g,18.47,21.06,43.41,cm,"{""Color"":""White"",""Size"":""M""}"
Garden,"Commodi Consequatur A (Garden)",commodi-consequatur-a-garden,"Ea qui exercitationem tempora cumque dolores adipisci eligendi omnis. Qui et voluptas ut illum sapiente adipisci. Quo provident placeat et possimus voluptas. Molestiae aliquam vero eos ut qui rerum odio. Praesentium quidem aut nobis officia ea eum. Ducimus eos est magni quaerat suscipit est aut.","Deserunt dolor eos dolore non est ratione.",active,https://picsum.photos/300/300?random=87,"[""https:\/\/picsum.photos\/600\/600?random=870"",""https:\/\/picsum.photos\/600\/600?random=871""]","[{""name"":""Color"",""values"":[""Black"",""White""]},{""name"":""Size"",""values"":[""S"",""M"",""L""]}]","Commodi Consequatur A (Garden) - White / M",6ZW-00087,1499809997274,206.02,,118.4,133,1,1,183.29,g,15.89,27.83,25.78,cm,"{""Color"":""White"",""Size"":""M""}"
Garden,"Voluptatibus Esse Voluptatem (Garden)",voluptatibus-esse-voluptatem-garden,"At reprehenderit omnis nulla ducimus deserunt rem. Deserunt dolor maiores tempora. Praesentium ipsam commodi consequatur soluta. Reprehenderit reprehenderit distinctio suscipit vitae voluptas nulla. Eaque autem illum similique consectetur ut esse est.","Culpa est quod porro temporibus amet autem sit.",active,https://picsum.photos/300/300?random=88,"[""https:\/\/picsum.photos\/600\/600?random=880"",""https:\/\/picsum.photos\/600\/600?random=881""]","[{""name"":""Color"",""values"":[""Black"",""White""]},{""name"":""Size"",""values"":[""S"",""M"",""L""]}]","Voluptatibus Esse Voluptatem (Garden) - Black / L",5AT-00088,6198944892080,196.16,,122.6,137,1,1,4133.06,g,12.25,17.89,30.47,cm,"{""Color"":""Black"",""Size"":""L""}"
Garden,"Ipsa Eos Impedit (Garden)",ipsa-eos-impedit-garden,"Aperiam magni soluta voluptatem eum. Sint non esse commodi at eum libero. Officia voluptas beatae enim et aspernatur. Molestiae quam ea fuga saepe autem porro. Rerum voluptatem veritatis eius molestias sint. Dolores dolores sunt officiis quam voluptatem repudiandae tempora consectetur.","Possimus velit molestiae nostrum saepe velit.",active,https://picsum.photos/300/300?random=89,"[""https:\/\/picsum.photos\/600\/600?random=890"",""https:\/\/picsum.photos\/600\/600?random=891""]","[{""name"":""Color"",""values"":[""Black"",""White""]},{""name"":""Size"",""values"":[""S"",""M"",""L""]}]","Ipsa Eos Impedit (Garden) - White / S",FY7-00089,4246767684091,149.88,,99.92,87,1,0,601.27,g,41.57,46.48,12.36,cm,"{""Color"":""White"",""Size"":""S""}"
Garden,"Voluptatibus Consequatur Vero (Garden)",voluptatibus-consequatur-vero-garden,"Unde eos provident voluptas velit pariatur velit assumenda. Voluptates doloremque distinctio rerum ut. Temporibus aliquid quisquam ea natus consequatur dolorem. Dolor voluptatem esse et. Quia deleniti recusandae similique ut recusandae.","Ut voluptatum vitae eligendi qui doloribus esse voluptates.",active,https://picsum.photos/300/300?random=90,"[""https:\/\/picsum.photos\/600\/600?random=900"",""https:\/\/picsum.photos\/600\/600?random=901""]","[{""name"":""Color"",""values"":[""Black"",""White""]},{""name"":""Size"",""values"":[""S"",""M"",""L""]}]","Voluptatibus Consequatur Vero (Garden) - Black / L",9TV-00090,7842123803358,345.31,,138.68,147,1,0,3581.97,g,36.08,10.72,39.63,cm,"{""Color"":""Black"",""Size"":""L""}"
Garden,"Accusantium Nihil Ullam (Garden)",accusantium-nihil-ullam-garden,"Voluptatem et non magni similique minima fuga. Ut iure sapiente rerum est dolores assumenda ut. Ut sit blanditiis fuga. Aut provident est aspernatur dignissimos corrupti enim et natus.","Tempore veniam vero quia fugit.",active,https://picsum.photos/300/300?random=91,"[""https:\/\/picsum.photos\/600\/600?random=910"",""https:\/\/picsum.photos\/600\/600?random=911""]","[{""name"":""Color"",""values"":[""Black"",""White""]},{""name"":""Size"",""values"":[""S"",""M"",""L""]}]","Accusantium Nihil Ullam (Garden) - White / M",PAU-00091,6698883912509,386.29,,187.52,52,1,0,2192.46,g,41.51,40.02,6.53,cm,"{""Color"":""White"",""Size"":""M""}"
Garden,"Beatae Alias Repudiandae (Garden)",beatae-alias-repudiandae-garden,"Quo voluptas quas molestiae occaecati modi voluptatem adipisci quae. Dolor enim praesentium facilis eum et at quis. Nihil quia animi facere. Aut aut quae non.","Quaerat aliquid ipsam dicta similique sunt natus minus.",active,https://picsum.photos/300/300?random=92,"[""https:\/\/picsum.photos\/600\/600?random=920"",""https:\/\/picsum.photos\/600\/600?random=921""]","[{""name"":""Color"",""values"":[""Black"",""White""]},{""name"":""Size"",""values"":[""S"",""M"",""L""]}]","Beatae Alias Repudiandae (Garden) - Black / S",BX7-00092,1330462308345,119.85,,87.48,24,1,1,1615.38,g,17.87,20.03,7.04,cm,"{""Color"":""Black"",""Size"":""S""}"
Garden,"Quidem Ut Ex (Garden)",quidem-ut-ex-garden,"Rerum qui labore voluptatem expedita velit quia. Id eveniet nisi qui aut aut. Ducimus modi nulla quia doloremque et tempore dicta. Laboriosam adipisci labore dolor in.","Molestiae sunt excepturi quaerat cumque.",active,https://picsum.photos/300/300?random=93,"[""https:\/\/picsum.photos\/600\/600?random=930"",""https:\/\/picsum.photos\/600\/600?random=931""]","[{""name"":""Color"",""values"":[""Black"",""White""]},{""name"":""Size"",""values"":[""S"",""M"",""L""]}]","Quidem Ut Ex (Garden) - Black / L",HOY-00093,0894828852015,226.22,,113.11,117,1,0,3352.69,g,44.93,13.96,44.14,cm,"{""Color"":""Black"",""Size"":""L""}"
Garden,"Quia Sapiente Molestiae (Garden)",quia-sapiente-molestiae-garden,"Minus possimus omnis nobis in. Deserunt nihil facilis repellat voluptatibus qui quod rem aut. Ipsum odit et aut est eligendi repudiandae ratione voluptas. Doloribus dolores qui et minus dolor ducimus reiciendis facere. Temporibus voluptatem ea aut velit aut.","Atque expedita veniam qui excepturi tenetur repellat.",active,https://picsum.photos/300/300?random=94,"[""https:\/\/picsum.photos\/600\/600?random=940"",""https:\/\/picsum.photos\/600\/600?random=941""]","[{""name"":""Color"",""values"":[""Black"",""White""]},{""name"":""Size"",""values"":[""S"",""M"",""L""]}]","Quia Sapiente Molestiae (Garden) - Black / S",85E-00094,9012089221857,263.82,316.58,159.89,2,1,0,2349.33,g,35.17,8.25,43.94,cm,"{""Color"":""Black"",""Size"":""S""}"
Garden,"Est Aliquam Perspiciatis (Garden)",est-aliquam-perspiciatis-garden,"Sequi dolor omnis rem esse. Alias et voluptates ad consequuntur quia perferendis. Qui omnis quo aut eveniet quia modi. Error quo fugit asperiores recusandae autem.","Voluptatibus doloremque ea dolorem labore voluptate dignissimos ducimus quibusdam.",active,https://picsum.photos/300/300?random=95,"[""https:\/\/picsum.photos\/600\/600?random=950"",""https:\/\/picsum.photos\/600\/600?random=951""]","[{""name"":""Color"",""values"":[""Black"",""White""]},{""name"":""Size"",""values"":[""S"",""M"",""L""]}]","Est Aliquam Perspiciatis (Garden) - Black / M",9ZD-00095,4519094624406,382.69,,153.69,105,1,0,3302.34,g,9.89,36.01,38.4,cm,"{""Color"":""Black"",""Size"":""M""}"
Garden,"Eum Iusto Facere (Garden)",eum-iusto-facere-garden,"Magnam itaque aut illum culpa sint libero. Totam deserunt doloremque harum et rerum saepe nemo. Excepturi omnis eaque quisquam cum quisquam autem laboriosam. Eligendi non sunt iure officiis. Sit laborum voluptatum a aut nihil officia velit ut.","Ut et fugiat voluptas.",active,https://picsum.photos/300/300?random=96,"[""https:\/\/picsum.photos\/600\/600?random=960"",""https:\/\/picsum.photos\/600\/600?random=961""]","[{""name"":""Color"",""values"":[""Black"",""White""]},{""name"":""Size"",""values"":[""S"",""M"",""L""]}]","Eum Iusto Facere (Garden) - White / M",D6P-00096,9640125348857,436.79,,181.24,62,1,0,911.95,g,23.93,46.56,31.77,cm,"{""Color"":""White"",""Size"":""M""}"
Garden,"Optio Excepturi Ipsam (Garden)",optio-excepturi-ipsam-garden,"Cumque est ea similique velit repudiandae odit maxime. Corporis rerum repellat qui molestiae modi. Eveniet praesentium et porro ipsam commodi corrupti sit sed. Sed inventore ratione qui suscipit in ipsum.","Rerum et et porro minus totam inventore architecto.",active,https://picsum.photos/300/300?random=97,"[""https:\/\/picsum.photos\/600\/600?random=970"",""https:\/\/picsum.photos\/600\/600?random=971""]","[{""name"":""Color"",""values"":[""Black"",""White""]},{""name"":""Size"",""values"":[""S"",""M"",""L""]}]","Optio Excepturi Ipsam (Garden) - White / L",MSJ-00097,5563766364441,31.68,,24.37,30,1,0,4332.05,g,36.64,14.28,15.59,cm,"{""Color"":""White"",""Size"":""L""}"
Garden,"Voluptates Tenetur Illum (Garden)",voluptates-tenetur-illum-garden,"Quam sed fuga quod rem. Earum eveniet cumque fuga error ipsa sint. Repellat consectetur fuga aut error voluptas. Quia id quae aut dolorum eos voluptas. Aperiam harum aut enim hic veritatis et earum libero. Aut laudantium est labore quo omnis vel.","Quasi velit velit in accusamus sapiente omnis est.",active,https://picsum.photos/300/300?random=98,"[""https:\/\/picsum.photos\/600\/600?random=980"",""https:\/\/picsum.photos\/600\/600?random=981""]","[{""name"":""Color"",""values"":[""Black"",""White""]},{""name"":""Size"",""values"":[""S"",""M"",""L""]}]","Voluptates Tenetur Illum (Garden) - White / M",SQA-00098,8387388492804,185.22,,117.23,2,1,0,3953.94,g,34.44,5.18,24.15,cm,"{""Color"":""White"",""Size"":""M""}"
Garden,"Numquam Illum Voluptate (Garden)",numquam-illum-voluptate-garden,"Est nulla ut eius consequuntur. Eum architecto quam nam necessitatibus nihil numquam. Et explicabo architecto cupiditate. Nulla omnis optio nesciunt cum omnis mollitia sit.","Non eligendi dolorem est non occaecati.",active,https://picsum.photos/300/300?random=99,"[""https:\/\/picsum.photos\/600\/600?random=990"",""https:\/\/picsum.photos\/600\/600?random=991""]","[{""name"":""Color"",""values"":[""Black"",""White""]},{""name"":""Size"",""values"":[""S"",""M"",""L""]}]","Numquam Illum Voluptate (Garden) - Black / L",L8U-00099,1776080924909,13.89,,9.99,125,1,0,1005.3,g,12.26,11.29,5.65,cm,"{""Color"":""Black"",""Size"":""L""}"
Garden,"Qui Reprehenderit Est (Garden)",qui-reprehenderit-est-garden,"Sit ratione beatae eligendi maxime. Nam est molestiae eum odio corporis quam. Ullam sunt enim ex. Quas et quidem sit magni.","A et sunt distinctio.",active,https://picsum.photos/300/300?random=100,"[""https:\/\/picsum.photos\/600\/600?random=1000"",""https:\/\/picsum.photos\/600\/600?random=1001""]","[{""name"":""Color"",""values"":[""Black"",""White""]},{""name"":""Size"",""values"":[""S"",""M"",""L""]}]","Qui Reprehenderit Est (Garden) - Black / M",VQF-00100,0908536796162,18.14,21.77,7.59,96,1,0,2149.46,g,43.8,32.67,40.34,cm,"{""Color"":""Black"",""Size"":""M""}"
